{"iter": 0, "name": "R2-champion", "flags": {"rotation_momentum_weight": true, "rotation_defensive_symbol": "GLD", "lookbacks": [252]}, "decision": "BASELINE", "windows": {"2005-2024": {"final": 1367275.8601360584, "cagr": 0.1397875856076547, "mdd": -0.38975668393504703, "sharpe": 0.7430715582207792, "obj": 0.8162138156237078, "spy_cagr": 0.10321645690619041}, "2005-2014": {"final": 265465.747249083, "cagr": 0.1026597418125792, "mdd": -0.38975668393504703, "sharpe": 0.6031322815464604, "obj": 0.6551394033688447, "spy_cagr": 0.07665618090138704}, "2015-2024": {"final": 514519.5027428189, "cagr": 0.1781183223331435, "mdd": -0.3099987765878391, "sharpe": 0.8713281510345908, "obj": 0.9664731698087575, "spy_cagr": 0.13054581294606016}, "2018-2024": {"final": 379808.169514991, "cagr": 0.21027496284807956, "mdd": -0.30998096129034847, "sharpe": 0.9165590914797876, "obj": 1.06353100855313, "spy_cagr": 0.1367890043114084}, "WF-train 2005-2016": {"final": 289248.2099224037, "cagr": 0.09263305685441625, "mdd": -0.38975668393504703, "sharpe": 0.568781009624698, "obj": 0.6046899943601051, "spy_cagr": 0.07467856448671273}, "WF-test 2017-2024": {"final": 469443.7180989186, "cagr": 0.21356492974946795, "mdd": -0.3099728711713093, "sharpe": 0.9622463628882895, "obj": 1.096313457449091, "spy_cagr": 0.14653138246906727}}}
{"iter": 15, "name": "vol_target_0.20", "flags": {"rotation_momentum_weight": true, "rotation_defensive_symbol": "GLD", "lookbacks": [252], "rotation_vol_target": 0.2}, "decision": "KEEP", "windows": {"2005-2024": {"final": 1257930.345454931, "cagr": 0.1350446686906217, "mdd": -0.37699074421086937, "sharpe": 0.7526698103390572, "obj": 0.8163262339079198, "spy_cagr": 0.10321645690619041}, "2005-2014": {"final": 258146.70172724494, "cagr": 0.09957830610057083, "mdd": -0.37699074421086937, "sharpe": 0.6024295314407556, "obj": 0.6482737818391232, "spy_cagr": 0.07665618090138704}, "2015-2024": {"final": 485538.8681696756, "cagr": 0.17130339425320806, "mdd": -0.2858348702472688, "sharpe": 0.8927905713292044, "obj": 0.9743057339435002, "spy_cagr": 0.13054581294606016}, "2018-2024": {"final": 354421.83156369353, "cagr": 0.19836040499721252, "mdd": -0.28538791050120615, "sharpe": 0.9303619475511234, "obj": 1.0535047489227316, "spy_cagr": 0.1367890043114084}, "WF-train 2005-2016": {"final": 284758.44414622325, "cagr": 0.09120826339750687, "mdd": -0.37699074421086937, "sharpe": 0.5746133040506263, "obj": 0.6076727018722146, "spy_cagr": 0.07467856448671273}, "WF-test 2017-2024": {"final": 438063.6946269601, "cagr": 0.20310099307453822, "mdd": -0.28530717026251395, "sharpe": 0.9822811867067481, "obj": 1.0954204079176901, "spy_cagr": 0.14653138246906727}}}
{"iter": 16, "name": "vol_target_0.15", "flags": {"rotation_momentum_weight": true, "rotation_defensive_symbol": "GLD", "lookbacks": [252], "rotation_vol_target": 0.15}, "decision": "KEEP", "windows": {"2005-2024": {"final": 1239031.0276895114, "cagr": 0.13418540001172063, "mdd": -0.3500955509811925, "sharpe": 0.7781041196186237, "obj": 0.8400420058296841, "spy_cagr": 0.10321645690619041}, "2005-2014": {"final": 270729.5184252949, "cagr": 0.10482895726114183, "mdd": -0.3500955509811925, "sharpe": 0.6414737540387481, "obj": 0.6978193067582577, "spy_cagr": 0.07665618090138704}, "2015-2024": {"final": 457180.3418474761, "cagr": 0.1642706949692443, "mdd": -0.2688598028689522, "sharpe": 0.9113644969328143, "obj": 0.9788142609791826, "spy_cagr": 0.13054581294606016}, "2018-2024": {"final": 332715.8357939358, "cagr": 0.18757823630739345, "mdd": -0.267866754597034, "sharpe": 0.9433386671512245, "obj": 1.0449171311431946, "spy_cagr": 0.1367890043114084}, "WF-train 2005-2016": {"final": 299185.96853303624, "cagr": 0.09571598521972047, "mdd": -0.3500955509811925, "sharpe": 0.6110432291789986, "obj": 0.653118070645014, "spy_cagr": 0.07467856448671273}, "WF-test 2017-2024": {"final": 411290.3155861511, "cagr": 0.19364118443298084, "mdd": -0.26771346406243063, "sharpe": 1.0013099597884532, "obj": 1.0955295637162803, "spy_cagr": 0.14653138246906727}}}
{"iter": 17, "name": "vol_target_0.12", "flags": {"rotation_momentum_weight": true, "rotation_defensive_symbol": "GLD", "lookbacks": [252], "rotation_vol_target": 0.12}, "decision": "KEEP", "windows": {"2005-2024": {"final": 1238916.2725347488, "cagr": 0.13418014466884998, "mdd": -0.32775190955951755, "sharpe": 0.8117445612658487, "obj": 0.8736719367911678, "spy_cagr": 0.10321645690619041}, "2005-2014": {"final": 289814.652718444, "cagr": 0.11238816328084722, "mdd": -0.32775190955951755, "sharpe": 0.7006066596452672, "obj": 0.7720706244041876, "spy_cagr": 0.07665618090138704}, "2015-2024": {"final": 428981.88789571903, "cagr": 0.15687707045913535, "mdd": -0.2517822505687685, "sharpe": 0.9253201175540152, "obj": 0.9779826325801656, "spy_cagr": 0.13054581294606016}, "2018-2024": {"final": 311505.2821260399, "cagr": 0.17644320149521775, "mdd": -0.2504542688876924, "sharpe": 0.9506653287647328, "obj": 1.0299737231323514, "spy_cagr": 0.1367890043114084}, "WF-train 2005-2016": {"final": 319379.7722482028, "cagr": 0.10170166444330064, "mdd": -0.32775190955951755, "sharpe": 0.6624501207109639, "obj": 0.7164963206241397, "spy_cagr": 0.07467856448671273}, "WF-test 2017-2024": {"final": 385017.1168050058, "cagr": 0.1838190567514506, "mdd": -0.25028064240886183, "sharpe": 1.0147746168015452, "obj": 1.089349965366312, "spy_cagr": 0.14653138246906727}}}
{"iter": 18, "name": "vol_target_0.10", "flags": {"rotation_momentum_weight": true, "rotation_defensive_symbol": "GLD", "lookbacks": [252], "rotation_vol_target": 0.1}, "decision": "KEEP", "windows": {"2005-2024": {"final": 1158969.735067172, "cagr": 0.13040157363131843, "mdd": -0.311277273028151, "sharpe": 0.8214436700370417, "obj": 0.8758139034872977, "spy_cagr": 0.10321645690619041}, "2005-2014": {"final": 294349.6575170518, "cagr": 0.11411834491842954, "mdd": -0.311277273028151, "sharpe": 0.7238144177922619, "obj": 0.7987387458263469, "spy_cagr": 0.07665618090138704}, "2015-2024": {"final": 396375.2372962013, "cagr": 0.1477614070470441, "mdd": -0.22594735232172686, "sharpe": 0.9277188843171857, "obj": 0.9621500725191536, "spy_cagr": 0.13054581294606016}, "2018-2024": {"final": 288184.20872784156, "cagr": 0.1634236159235649, "mdd": -0.22494336397517228, "sharpe": 0.9432629991136147, "obj": 0.9965322223379277, "spy_cagr": 0.1367890043114084}, "WF-train 2005-2016": {"final": 323064.19532768766, "cagr": 0.10275618741789438, "mdd": -0.311277273028151, "sharpe": 0.6832162809223928, "obj": 0.7393715267847562, "spy_cagr": 0.07467856448671273}, "WF-test 2017-2024": {"final": 356152.67932254076, "cagr": 0.17232776282930562, "mdd": -0.22480238635980684, "sharpe": 1.0146170695886214, "obj": 1.066209830309098, "spy_cagr": 0.14653138246906727}}}
{"iter": 19, "name": "poscap_0.50", "flags": {"rotation_momentum_weight": true, "rotation_defensive_symbol": "GLD", "lookbacks": [252], "rotation_vol_target": 0.1, "rotation_position_cap": 0.5}, "decision": "REVERT", "windows": {"2005-2024": {"final": 1091278.5923544466, "cagr": 0.12700336946823754, "mdd": -0.2967593933358443, "sharpe": 0.8142235778040294, "obj": 0.8617974029281237, "spy_cagr": 0.10321645690619041}, "2005-2014": {"final": 284888.1378921333, "cagr": 0.11048078321336097, "mdd": -0.2967593933358443, "sharpe": 0.7160930216913117, "obj": 0.7837422263152596, "spy_cagr": 0.07665618090138704}, "2015-2024": {"final": 385474.9415075956, "cagr": 0.1445631301197463, "mdd": -0.22552137672702144, "sharpe": 0.9199007366230937, "obj": 0.947935370970466, "spy_cagr": 0.13054581294606016}, "2018-2024": {"final": 280345.58391452616, "cagr": 0.15884435623567583, "mdd": -0.22450389603127527, "sharpe": 0.9320677242778256, "obj": 0.9761784281263605, "spy_cagr": 0.1367890043114084}, "WF-train 2005-2016": {"final": 312592.1366784106, "cagr": 0.09972943379560939, "mdd": -0.2967593933358443, "sharpe": 0.6761997045889669, "obj": 0.7263014432067603, "spy_cagr": 0.07467856448671273}, "WF-test 2017-2024": {"final": 346481.76585251896, "cagr": 0.1682950116982691, "mdd": -0.22436673917407085, "sharpe": 1.0059317144068944, "obj": 1.049458972865298, "spy_cagr": 0.14653138246906727}}}
{"iter": 20, "name": "poscap_0.40", "flags": {"rotation_momentum_weight": true, "rotation_defensive_symbol": "GLD", "lookbacks": [252], "rotation_vol_target": 0.1, "rotation_position_cap": 0.4}, "decision": "REVERT", "windows": {"2005-2024": {"final": 1044508.9421332926, "cagr": 0.12453640534721089, "mdd": -0.2902556596895775, "sharpe": 0.8122718673287469, "obj": 0.8549117642107879, "spy_cagr": 0.10321645690619041}, "2005-2014": {"final": 277403.6899779055, "cagr": 0.10752547676924928, "mdd": -0.2902556596895775, "sharpe": 0.7100830552214688, "obj": 0.7718216469571932, "spy_cagr": 0.07665618090138704}, "2015-2024": {"final": 378858.3384048416, "cagr": 0.14258181249497315, "mdd": -0.22551321027578955, "sharpe": 0.9219462957495836, "obj": 0.9460182948474096, "spy_cagr": 0.13054581294606016}, "2018-2024": {"final": 279314.8226807963, "cagr": 0.15823405529893075, "mdd": -0.22443277198616723, "sharpe": 0.9431563411399762, "obj": 0.9860464431150209, "spy_cagr": 0.1367890043114084}, "WF-train 2005-2016": {"final": 301133.93721991713, "cagr": 0.09630926776784388, "mdd": -0.2902556596895775, "sharpe": 0.6655513008814629, "obj": 0.7088127074437252, "spy_cagr": 0.07467856448671273}, "WF-test 2017-2024": {"final": 344142.4980327615, "cagr": 0.16730476566562835, "mdd": -0.22424717673282515, "sharpe": 1.016078426903376, "obj": 1.0576251932964982, "spy_cagr": 0.14653138246906727}}}
{"iter": 21, "name": "defensive_TLT", "flags": {"rotation_momentum_weight": true, "rotation_defensive_symbol": "TLT", "lookbacks": [252], "rotation_vol_target": 0.1}, "decision": "REVERT", "windows": {"2005-2024": {"final": 723768.3191856489, "cagr": 0.10408758362797088, "mdd": -0.26467622036442556, "sharpe": 0.7469859185049255, "obj": 0.7487281719484864, "spy_cagr": 0.10321645690619041}, "2005-2014": {"final": 259215.65793078602, "cagr": 0.10003321878111726, "mdd": -0.26467622036442556, "sharpe": 0.759709551714165, "obj": 0.8064636274736254, "spy_cagr": 0.07665618090138704}, "2015-2024": {"final": 280729.7720745505, "cagr": 0.10881617335330329, "mdd": -0.22880356328572501, "sharpe": 0.7416569333415153, "obj": 0.6981976541560015, "spy_cagr": 0.13054581294606016}, "2018-2024": {"final": 205836.46737751455, "cagr": 0.10875892553744793, "mdd": -0.22627195066095257, "sharpe": 0.6952622746197786, "obj": 0.6392021170718577, "spy_cagr": 0.1367890043114084}, "WF-train 2005-2016": {"final": 282932.17641737906, "cagr": 0.09062281231087055, "mdd": -0.26467622036442556, "sharpe": 0.7113145461098311, "obj": 0.7432030417581468, "spy_cagr": 0.07467856448671273}, "WF-test 2017-2024": {"final": 254401.79992690156, "cagr": 0.12398239379068521, "mdd": -0.22601926619628432, "sharpe": 0.79513215298795, "obj": 0.7500341756311859, "spy_cagr": 0.14653138246906727}}}
{"iter": 22, "name": "defensive_IEF", "flags": {"rotation_momentum_weight": true, "rotation_defensive_symbol": "IEF", "lookbacks": [252], "rotation_vol_target": 0.1}, "decision": "REVERT", "windows": {"2005-2024": {"final": 696983.2460746306, "cagr": 0.10200665128090036, "mdd": -0.1919222875478188, "sharpe": 0.7741421917639737, "obj": 0.7717225805133936, "spy_cagr": 0.10321645690619041}, "2005-2014": {"final": 238821.0425530083, "cagr": 0.09104715821932907, "mdd": -0.15700494566865927, "sharpe": 0.7561741025747468, "obj": 0.7849560572106309, "spy_cagr": 0.07665618090138704}, "2015-2024": {"final": 292056.148347035, "cagr": 0.11321363378139182, "mdd": -0.1934904026632942, "sharpe": 0.7954039866708846, "obj": 0.760739628341548, "spy_cagr": 0.13054581294606016}, "2018-2024": {"final": 218608.74603590072, "cagr": 0.11834598025446996, "mdd": -0.19194309423609823, "sharpe": 0.7779850087009581, "obj": 0.7410989605870812, "spy_cagr": 0.1367890043114084}, "WF-train 2005-2016": {"final": 256301.30669250095, "cagr": 0.0816672554939808, "mdd": -0.15700494566865927, "sharpe": 0.6947266207294805, "obj": 0.7087040027440167, "spy_cagr": 0.07467856448671273}, "WF-test 2017-2024": {"final": 270213.9617028235, "cagr": 0.13249800683533075, "mdd": -0.19175780931335723, "sharpe": 0.8757491044143426, "obj": 0.8476823531468696, "spy_cagr": 0.14653138246906727}}}
{"iter": 23, "name": "plus_cluster", "flags": {"rotation_momentum_weight": true, "rotation_defensive_symbol": "GLD", "lookbacks": [252], "rotation_vol_target": 0.1, "rotation_cluster_filter": true}, "decision": "REVERT", "windows": {"2005-2024": {"final": 1086138.0306570956, "cagr": 0.12673718565484116, "mdd": -0.311240542412063, "sharpe": 0.8195524217226664, "obj": 0.8665938792199679, "spy_cagr": 0.10321645690619041}, "2005-2014": {"final": 312804.4943304815, "cagr": 0.12092047813089724, "mdd": -0.311240542412063, "sharpe": 0.7606978953008682, "obj": 0.8492264897598886, "spy_cagr": 0.07665618090138704}, "2015-2024": {"final": 350225.37856550334, "cagr": 0.1336318663758722, "mdd": -0.21879236288654272, "sharpe": 0.8917767676096711, "obj": 0.8979488744692952, "spy_cagr": 0.13054581294606016}, "2018-2024": {"final": 255775.16354775074, "cagr": 0.14374239269883926, "mdd": -0.21768296718082253, "sharpe": 0.8886279957041501, "obj": 0.9025347724790118, "spy_cagr": 0.1367890043114084}, "WF-train 2005-2016": {"final": 348024.03815169435, "cagr": 0.10962269633898325, "mdd": -0.311240542412063, "sharpe": 0.722907809173256, "obj": 0.7927960728777971, "spy_cagr": 0.07467856448671273}, "WF-test 2017-2024": {"final": 310060.341923218, "cagr": 0.15216581939556217, "mdd": -0.21775634548612197, "sharpe": 0.9612341842230467, "obj": 0.9725030580760365, "spy_cagr": 0.14653138246906727}}}
{"iter": 24, "name": "plus_trend", "flags": {"rotation_momentum_weight": true, "rotation_defensive_symbol": "GLD", "lookbacks": [252], "rotation_vol_target": 0.1, "rotation_trend_filter": true}, "decision": "REVERT", "windows": {"2005-2024": {"final": 973509.9128352257, "cagr": 0.12058316352049925, "mdd": -0.32997826750183124, "sharpe": 0.7708633545678603, "obj": 0.8055967677964779, "spy_cagr": 0.10321645690619041}, "2005-2014": {"final": 265950.96326559124, "cagr": 0.10286131260820386, "mdd": -0.32997826750183124, "sharpe": 0.6660807337507537, "obj": 0.7184909971643874, "spy_cagr": 0.07665618090138704}, "2015-2024": {"final": 369958.30737645767, "cagr": 0.13986703218795693, "mdd": -0.22680242381956298, "sharpe": 0.8862616394902626, "obj": 0.9049040779740561, "spy_cagr": 0.13054581294606016}, "2018-2024": {"final": 271838.85583175626, "cagr": 0.15374892861941847, "mdd": -0.2249070376930932, "sharpe": 0.8987218576267321, "obj": 0.9326417062427522, "spy_cagr": 0.1367890043114084}, "WF-train 2005-2016": {"final": 288861.80951865984, "cagr": 0.09251123574815612, "mdd": -0.32997826750183124, "sharpe": 0.6271333356378473, "obj": 0.6627986781607341, "spy_cagr": 0.07467856448671273}, "WF-test 2017-2024": {"final": 335905.1221473368, "cagr": 0.16377023583101002, "mdd": -0.2247660100984454, "sharpe": 0.97451476798694, "obj": 1.0089924747108254, "spy_cagr": 0.14653138246906727}}}
{"iter": 25, "name": "plus_top4", "flags": {"rotation_momentum_weight": true, "rotation_defensive_symbol": "GLD", "lookbacks": [252], "rotation_vol_target": 0.1, "top_n": 4}, "decision": "REVERT", "windows": {"2005-2024": {"final": 1034306.7563369477, "cagr": 0.12398434634666677, "mdd": -0.30566493063172645, "sharpe": 0.8114014332997321, "obj": 0.8529372121806849, "spy_cagr": 0.10321645690619041}, "2005-2014": {"final": 297031.28821410844, "cagr": 0.11513017931033631, "mdd": -0.30566493063172645, "sharpe": 0.745282561179756, "obj": 0.8222305579976545, "spy_cagr": 0.07665618090138704}, "2015-2024": {"final": 350937.4178343434, "cagr": 0.1338622909352829, "mdd": -0.22128258127009, "sharpe": 0.8875557091788481, "obj": 0.8941886651572936, "spy_cagr": 0.13054581294606016}, "2018-2024": {"final": 262763.28826151456, "cagr": 0.14815983468740934, "mdd": -0.2202741296267098, "sharpe": 0.9052025358606002, "obj": 0.9279441966126021, "spy_cagr": 0.1367890043114084}, "WF-train 2005-2016": {"final": 319124.11053647666, "cagr": 0.10162807814626129, "mdd": -0.30566493063172645, "sharpe": 0.6913818359617, "obj": 0.7452808632807971, "spy_cagr": 0.07467856448671273}, "WF-test 2017-2024": {"final": 321658.10239685094, "cagr": 0.1574740259565519, "mdd": -0.220324022256404, "sharpe": 0.9817266796971476, "obj": 1.0036119666721168, "spy_cagr": 0.14653138246906727}}}
{"iter": 26, "name": "plus_skip21", "flags": {"rotation_momentum_weight": true, "rotation_defensive_symbol": "GLD", "lookbacks": [252], "rotation_vol_target": 0.1, "rotation_skip_days": 21}, "decision": "REVERT", "windows": {"2005-2024": {"final": 1098133.3774593652, "cagr": 0.12735647041908393, "mdd": -0.33007479102207266, "sharpe": 0.8028725482365564, "obj": 0.8511525752623434, "spy_cagr": 0.10321645690619041}, "2005-2014": {"final": 291714.08215874544, "cagr": 0.11311577258308336, "mdd": -0.33007479102207266, "sharpe": 0.7139605177976479, "obj": 0.7868797011610406, "spy_cagr": 0.07665618090138704}, "2015-2024": {"final": 380542.721653408, "cagr": 0.14308913191510042, "mdd": -0.22304983750191537, "sharpe": 0.9033403638141402, "obj": 0.9284270017522207, "spy_cagr": 0.13054581294606016}, "2018-2024": {"final": 273374.8297443359, "cagr": 0.1546789734068612, "mdd": -0.22282764153496298, "sharpe": 0.9046670224935108, "obj": 0.9404469606844165, "spy_cagr": 0.1367890043114084}, "WF-train 2005-2016": {"final": 315268.8134639053, "cagr": 0.10051181904640893, "mdd": -0.33007479102207266, "sharpe": 0.6653578625843848, "obj": 0.7170243717037772, "spy_cagr": 0.07467856448671273}, "WF-test 2017-2024": {"final": 346094.12686672254, "cagr": 0.16813132358133265, "mdd": -0.22272800718289337, "sharpe": 0.9976413853513173, "obj": 1.040841267575848, "spy_cagr": 0.14653138246906727}}}
{"iter": 27, "name": "vt15_capF0.20", "flags": {"rotation_momentum_weight": true, "rotation_defensive_symbol": "GLD", "lookbacks": [252], "rotation_vol_target": 0.15, "rotation_weight_floor": 0.2}, "decision": "REVERT", "windows": {"2005-2024": {"final": 1220184.531704546, "cagr": 0.13331604342713232, "mdd": -0.3475356983287932, "sharpe": 0.7763344202409358, "obj": 0.8365335932828196, "spy_cagr": 0.10321645690619041}, "2005-2014": {"final": 268986.48079889244, "cagr": 0.10411488197889174, "mdd": -0.3475356983287932, "sharpe": 0.6395209006098536, "obj": 0.694438302764863, "spy_cagr": 0.07665618090138704}, "2015-2024": {"final": 453139.0504633995, "cagr": 0.16323670190649908, "mdd": -0.26885324831410645, "sharpe": 0.9099367095571339, "obj": 0.9753184874780118, "spy_cagr": 0.13054581294606016}, "2018-2024": {"final": 330136.8366481383, "cagr": 0.18625737777426377, "mdd": -0.2678564804273038, "sharpe": 0.9418756650304234, "obj": 1.0408124119561342, "spy_cagr": 0.1367890043114084}, "WF-train 2005-2016": {"final": 296925.6155794379, "cagr": 0.09502310733076325, "mdd": -0.3475356983287932, "sharpe": 0.608817981273065, "obj": 0.649507066961166, "spy_cagr": 0.07467856448671273}, "WF-test 2017-2024": {"final": 408105.71649129794, "cagr": 0.1924803759713858, "mdd": -0.2677032543980213, "sharpe": 1.000477935518957, "obj": 1.092375922523594, "spy_cagr": 0.14653138246906727}}}
{"iter": 28, "name": "vt12_TLT", "flags": {"rotation_momentum_weight": true, "rotation_defensive_symbol": "TLT", "lookbacks": [252], "rotation_vol_target": 0.12}, "decision": "REVERT", "windows": {"2005-2024": {"final": 843382.5185743321, "cagr": 0.11256808279958674, "mdd": -0.2662220222682751, "sharpe": 0.753476112241511, "obj": 0.7721793640283037, "spy_cagr": 0.10321645690619041}, "2005-2014": {"final": 261975.17838424136, "cagr": 0.10119982220855861, "mdd": -0.26467635244918364, "sharpe": 0.7203890013572878, "obj": 0.7694762839716309, "spy_cagr": 0.07665618090138704}, "2015-2024": {"final": 322616.8775028427, "cagr": 0.12435524437403433, "mdd": -0.2697842310273783, "sharpe": 0.7863265305467305, "obj": 0.7739453934026789, "spy_cagr": 0.13054581294606016}, "2018-2024": {"final": 239823.03955850296, "cagr": 0.13325740086057913, "mdd": -0.26704352014651156, "sharpe": 0.7797790992236865, "obj": 0.772715892322028, "spy_cagr": 0.1367890043114084}, "WF-train 2005-2016": {"final": 282781.6922046253, "cagr": 0.0905744168821121, "mdd": -0.26467635244918364, "sharpe": 0.6674906002169666, "obj": 0.6992823050077653, "spy_cagr": 0.07467856448671273}, "WF-test 2017-2024": {"final": 296450.79344676237, "cagr": 0.1457106400112136, "mdd": -0.2667310196921016, "sharpe": 0.8640611230756953, "obj": 0.8624196381599879, "spy_cagr": 0.14653138246906727}}}
{"iter": 29, "name": "vt15_poscap0.5", "flags": {"rotation_momentum_weight": true, "rotation_defensive_symbol": "GLD", "lookbacks": [252], "rotation_vol_target": 0.15, "rotation_position_cap": 0.5}, "decision": "REVERT", "windows": {"2005-2024": {"final": 1133881.3168963236, "cagr": 0.12916463636403575, "mdd": -0.32867832785184886, "sharpe": 0.7681322556062791, "obj": 0.8200286145219697, "spy_cagr": 0.10321645690619041}, "2005-2014": {"final": 258412.3233039238, "cagr": 0.09969150398446769, "mdd": -0.32867832785184886, "sharpe": 0.6293179620855175, "obj": 0.6753886082516788, "spy_cagr": 0.07665618090138704}, "2015-2024": {"final": 438317.7331903827, "cagr": 0.159372146247877, "mdd": -0.26862717346814236, "sharpe": 0.9022862778282363, "obj": 0.95993894443187, "spy_cagr": 0.13054581294606016}, "2018-2024": {"final": 319010.6868434665, "cagr": 0.18045564004580417, "mdd": -0.2675979259475105, "sharpe": 0.9300312759779329, "obj": 1.0173645474467246, "spy_cagr": 0.1367890043114084}, "WF-train 2005-2016": {"final": 285670.75035061676, "cagr": 0.0914994357339316, "mdd": -0.32867832785184886, "sharpe": 0.6005766600351167, "obj": 0.6342184025295544, "spy_cagr": 0.07467856448671273}, "WF-test 2017-2024": {"final": 394373.27019921225, "cagr": 0.18738222379189362, "mdd": -0.26744698282928037, "sharpe": 0.9912748479507847, "obj": 1.0729765305964374, "spy_cagr": 0.14653138246906727}}}
