{"iter": 0, "name": "R3-champion", "flags": {"rotation_momentum_weight": true, "rotation_defensive_symbol": "GLD", "lookbacks": [252], "rotation_vol_target": 0.1}, "decision": "BASELINE", "windows": {"2005-2024": {"final": 1158969.735067172, "cagr": 0.13040157363131843, "mdd": -0.311277273028151, "sharpe": 0.8214436700370417, "obj": 0.8758139034872977, "spy_cagr": 0.10321645690619041}, "2005-2014": {"final": 294349.6575170518, "cagr": 0.11411834491842954, "mdd": -0.311277273028151, "sharpe": 0.7238144177922619, "obj": 0.7987387458263469, "spy_cagr": 0.07665618090138704}, "2015-2024": {"final": 396375.2372962013, "cagr": 0.1477614070470441, "mdd": -0.22594735232172686, "sharpe": 0.9277188843171857, "obj": 0.9621500725191536, "spy_cagr": 0.13054581294606016}, "2018-2024": {"final": 288184.20872784156, "cagr": 0.1634236159235649, "mdd": -0.22494336397517228, "sharpe": 0.9432629991136147, "obj": 0.9965322223379277, "spy_cagr": 0.1367890043114084}, "WF-train 2005-2016": {"final": 323064.19532768766, "cagr": 0.10275618741789438, "mdd": -0.311277273028151, "sharpe": 0.6832162809223928, "obj": 0.7393715267847562, "spy_cagr": 0.07467856448671273}, "WF-test 2017-2024": {"final": 356152.67932254076, "cagr": 0.17232776282930562, "mdd": -0.22480238635980684, "sharpe": 1.0146170695886214, "obj": 1.066209830309098, "spy_cagr": 0.14653138246906727}}}
{"iter": 30, "name": "vt_0.08", "flags": {"rotation_momentum_weight": true, "rotation_defensive_symbol": "GLD", "lookbacks": [252], "rotation_vol_target": 0.08}, "decision": "REVERT", "windows": {"2005-2024": {"final": 1043871.5196173473, "cagr": 0.12450206358693361, "mdd": -0.29475901175849395, "sharpe": 0.8236788227269647, "obj": 0.8662500360884511, "spy_cagr": 0.10321645690619041}, "2005-2014": {"final": 299359.15512907325, "cagr": 0.11600188783920196, "mdd": -0.29475901175849395, "sharpe": 0.7503169627267307, "obj": 0.8290083766023605, "spy_cagr": 0.07665618090138704}, "2015-2024": {"final": 350310.8725059994, "cagr": 0.13365955551336794, "mdd": -0.19948255731611889, "sharpe": 0.9090200825851226, "obj": 0.9152475677197381, "spy_cagr": 0.13054581294606016}, "2018-2024": {"final": 259220.94486703616, "cagr": 0.14593334754758325, "mdd": -0.1988259727724917, "sharpe": 0.9169647219778373, "obj": 0.935253408450187, "spy_cagr": 0.1367890043114084}, "WF-train 2005-2016": {"final": 326417.15062383853, "cagr": 0.1037063036569994, "mdd": -0.29475901175849395, "sharpe": 0.706727036752136, "obj": 0.7647825150927093, "spy_cagr": 0.07467856448671273}, "WF-test 2017-2024": {"final": 317912.7959576242, "cagr": 0.1557783943163864, "mdd": -0.1988795492357166, "sharpe": 0.9942030808277544, "obj": 1.0126971045223927, "spy_cagr": 0.14653138246906727}}}
{"iter": 31, "name": "vt_0.09", "flags": {"rotation_momentum_weight": true, "rotation_defensive_symbol": "GLD", "lookbacks": [252], "rotation_vol_target": 0.09}, "decision": "REVERT", "windows": {"2005-2024": {"final": 1096055.148799606, "cagr": 0.12724963922684296, "mdd": -0.30301878325301485, "sharpe": 0.8211223677968, "obj": 0.8691887324381051, "spy_cagr": 0.10321645690619041}, "2005-2014": {"final": 295667.1298664321, "cagr": 0.11461648629531651, "mdd": -0.30301878325301485, "sharpe": 0.7346417913120534, "obj": 0.8105624020999124, "spy_cagr": 0.07665618090138704}, "2015-2024": {"final": 372893.21581745247, "cagr": 0.14076870310373168, "mdd": -0.21286095156768994, "sharpe": 0.9180776505125606, "obj": 0.9385234308279037, "spy_cagr": 0.13054581294606016}, "2018-2024": {"final": 273684.9927068993, "cagr": 0.15486623596907, "mdd": -0.21193387163789204, "sharpe": 0.9302376844058907, "obj": 0.966392147721214, "spy_cagr": 0.1367890043114084}, "WF-train 2005-2016": {"final": 323080.52894772834, "cagr": 0.10276083768972288, "mdd": -0.30301878325301485, "sharpe": 0.6923765493287474, "obj": 0.7485410957347677, "spy_cagr": 0.07467856448671273}, "WF-test 2017-2024": {"final": 336809.46264748124, "cagr": 0.16416195665373623, "mdd": -0.21189771473147345, "sharpe": 1.0037537081947454, "obj": 1.0390148565640833, "spy_cagr": 0.14653138246906727}}}
{"iter": 32, "name": "vt_0.11", "flags": {"rotation_momentum_weight": true, "rotation_defensive_symbol": "GLD", "lookbacks": [252], "rotation_vol_target": 0.11}, "decision": "REVERT", "windows": {"2005-2024": {"final": 1202345.9744926114, "cagr": 0.13248134950747903, "mdd": -0.3195144188279932, "sharpe": 0.8170302411904052, "obj": 0.8755600263929825, "spy_cagr": 0.10321645690619041}, "2005-2014": {"final": 291678.8465145009, "cagr": 0.1131023138207421, "mdd": -0.3195144188279932, "sharpe": 0.7110467577353479, "obj": 0.783939023574058, "spy_cagr": 0.07665618090138704}, "2015-2024": {"final": 414424.7104959799, "cagr": 0.15288729992931116, "mdd": -0.23899620282654768, "sharpe": 0.9286190658702774, "obj": 0.9733020398367794, "spy_cagr": 0.13054581294606016}, "2018-2024": {"final": 300713.8724728932, "cagr": 0.17052633032079734, "mdd": -0.23779764755943184, "sharpe": 0.9490867671107034, "obj": 1.0165614191294812, "spy_cagr": 0.1367890043114084}, "WF-train 2005-2016": {"final": 321069.57323008054, "cagr": 0.10218668108528894, "mdd": -0.3195144188279932, "sharpe": 0.6721652653186388, "obj": 0.7271814985157913, "spy_cagr": 0.07467856448671273}, "WF-test 2017-2024": {"final": 371651.4121218364, "cagr": 0.17859519532873813, "mdd": -0.23764050632436412, "sharpe": 1.0164387003826778, "obj": 1.0805663261020195, "spy_cagr": 0.14653138246906727}}}
{"iter": 33, "name": "vt_0.13", "flags": {"rotation_momentum_weight": true, "rotation_defensive_symbol": "GLD", "lookbacks": [252], "rotation_vol_target": 0.13}, "decision": "REVERT", "windows": {"2005-2024": {"final": 1262554.2715225958, "cagr": 0.13525303044307435, "mdd": -0.33598564679228254, "sharpe": 0.8045290348781834, "obj": 0.8686021819519513, "spy_cagr": 0.10321645690619041}, "2005-2014": {"final": 285565.1610104394, "cagr": 0.1107446547853792, "mdd": -0.33598564679228254, "sharpe": 0.6847485336112276, "obj": 0.7529254813792119, "spy_cagr": 0.07665618090138704}, "2015-2024": {"final": 442948.2384993938, "cagr": 0.16059198934661034, "mdd": -0.26016931786714803, "sharpe": 0.9244478567829862, "obj": 0.9845402095840866, "spy_cagr": 0.13054581294606016}, "2018-2024": {"final": 321085.0920489352, "cagr": 0.1815503534771723, "mdd": -0.25876697488481426, "sharpe": 0.9516450426680156, "obj": 1.0411677409995435, "spy_cagr": 0.1367890043114084}, "WF-train 2005-2016": {"final": 315874.70283870463, "cagr": 0.100688073502738, "mdd": -0.33598564679228254, "sharpe": 0.6500656182724294, "obj": 0.7020846363044799, "spy_cagr": 0.07467856448671273}, "WF-test 2017-2024": {"final": 396900.33542016655, "cagr": 0.18833193234096512, "mdd": -0.25860377201458956, "sharpe": 1.0130850332728891, "obj": 1.0966861330166848, "spy_cagr": 0.14653138246906727}}}
{"iter": 34, "name": "volwin_30", "flags": {"rotation_momentum_weight": true, "rotation_defensive_symbol": "GLD", "lookbacks": [252], "rotation_vol_target": 0.1, "rotation_vol_window": 30}, "decision": "KEEP", "windows": {"2005-2024": {"final": 1172843.2980736124, "cagr": 0.13107470419442402, "mdd": -0.31592625610169084, "sharpe": 0.8214115598417963, "obj": 0.8771280544182635, "spy_cagr": 0.10321645690619041}, "2005-2014": {"final": 299162.3141227848, "cagr": 0.11592841398056186, "mdd": -0.31592625610169084, "sharpe": 0.7329936257692057, "obj": 0.8115380919275553, "spy_cagr": 0.07665618090138704}, "2015-2024": {"final": 394003.4163790242, "cagr": 0.14707228434003405, "mdd": -0.24605368479875428, "sharpe": 0.9159216762234967, "obj": 0.9489746190114445, "spy_cagr": 0.13054581294606016}, "2018-2024": {"final": 289446.5778976655, "cagr": 0.16415107686902353, "mdd": -0.24480634394299788, "sharpe": 0.9356441588088453, "obj": 0.9903683039240756, "spy_cagr": 0.1367890043114084}, "WF-train 2005-2016": {"final": 325445.9992776807, "cagr": 0.10343203534172551, "mdd": -0.31592625610169084, "sharpe": 0.6873515319908446, "obj": 0.7448584737008702, "spy_cagr": 0.07467856448671273}, "WF-test 2017-2024": {"final": 357722.20963705133, "cagr": 0.17297319678535406, "mdd": -0.2446314016925804, "sharpe": 1.0063252684382167, "obj": 1.0592088970707902, "spy_cagr": 0.14653138246906727}}}
{"iter": 35, "name": "volwin_40", "flags": {"rotation_momentum_weight": true, "rotation_defensive_symbol": "GLD", "lookbacks": [252], "rotation_vol_target": 0.1, "rotation_vol_window": 40}, "decision": "REVERT", "windows": {"2005-2024": {"final": 1133625.1260226483, "cagr": 0.12915187174633602, "mdd": -0.31562222801375817, "sharpe": 0.8095849301515509, "obj": 0.8614557598318421, "spy_cagr": 0.10321645690619041}, "2005-2014": {"final": 302409.1668881582, "cagr": 0.11713482949933529, "mdd": -0.31562222801375817, "sharpe": 0.7403700065717309, "obj": 0.8213273037676274, "spy_cagr": 0.07665618090138704}, "2015-2024": {"final": 374960.862597138, "cagr": 0.14140010474114906, "mdd": -0.25743719565782736, "sharpe": 0.880624540211645, "obj": 0.9023331238018228, "spy_cagr": 0.13054581294606016}, "2018-2024": {"final": 280036.9015987244, "cagr": 0.15866179125893476, "mdd": -0.2564773046457918, "sharpe": 0.9021128450262803, "obj": 0.945858418921333, "spy_cagr": 0.1367890043114084}, "WF-train 2005-2016": {"final": 325138.27382942464, "cagr": 0.1033449723444515, "mdd": -0.31562222801375817, "sharpe": 0.6881959885217248, "obj": 0.7455288042372024, "spy_cagr": 0.07467856448671273}, "WF-test 2017-2024": {"final": 346150.802123887, "cagr": 0.16815526582081253, "mdd": -0.256294374606301, "sharpe": 0.9750375157174518, "obj": 1.0182852824209423, "spy_cagr": 0.14653138246906727}}}
{"iter": 36, "name": "volwin_60", "flags": {"rotation_momentum_weight": true, "rotation_defensive_symbol": "GLD", "lookbacks": [252], "rotation_vol_target": 0.1, "rotation_vol_window": 60}, "decision": "REVERT", "windows": {"2005-2024": {"final": 1045290.0560144682, "cagr": 0.12457846148353013, "mdd": -0.30841062330955765, "sharpe": 0.7847588809509192, "obj": 0.8274828901055986, "spy_cagr": 0.10321645690619041}, "2005-2014": {"final": 304220.07565288694, "cagr": 0.11780264461523493, "mdd": -0.30841062330955765, "sharpe": 0.7457465845988573, "obj": 0.8280395120265531, "spy_cagr": 0.07665618090138704}, "2015-2024": {"final": 342603.91425721336, "cagr": 0.13113870095441427, "mdd": -0.27066802507628973, "sharpe": 0.822591665975835, "obj": 0.8237774419925432, "spy_cagr": 0.13054581294606016}, "2018-2024": {"final": 254483.96448457998, "cagr": 0.14291488177299527, "mdd": -0.26980554127467826, "sharpe": 0.8222756490447419, "obj": 0.8345274039679157, "spy_cagr": 0.1367890043114084}, "WF-train 2005-2016": {"final": 329725.3822827751, "cagr": 0.10463501950317822, "mdd": -0.30841062330955765, "sharpe": 0.6973166218814596, "obj": 0.7572295319143906, "spy_cagr": 0.07467856448671273}, "WF-test 2017-2024": {"final": 314631.2977779163, "cagr": 0.15427831999330688, "mdd": -0.2696510317850339, "sharpe": 0.9020219317925039, "obj": 0.9175158068409831, "spy_cagr": 0.14653138246906727}}}
{"iter": 37, "name": "volwin_10", "flags": {"rotation_momentum_weight": true, "rotation_defensive_symbol": "GLD", "lookbacks": [252], "rotation_vol_target": 0.1, "rotation_vol_window": 10}, "decision": "REVERT", "windows": {"2005-2024": {"final": 1102025.9784986787, "cagr": 0.12755605352808685, "mdd": -0.3115266583183487, "sharpe": 0.8056312054036002, "obj": 0.8543103986473931, "spy_cagr": 0.10321645690619041}, "2005-2014": {"final": 295494.4814447364, "cagr": 0.11455132112655386, "mdd": -0.3115266583183487, "sharpe": 0.7275620719569832, "obj": 0.8033523524073168, "spy_cagr": 0.07665618090138704}, "2015-2024": {"final": 372727.5950508466, "cagr": 0.14071799094747028, "mdd": -0.234079826089518, "sharpe": 0.88520313658393, "obj": 0.9055474925867503, "spy_cagr": 0.13054581294606016}, "2018-2024": {"final": 276863.66650349187, "cagr": 0.15677496701775495, "mdd": -0.2307199242894888, "sharpe": 0.9075719472782922, "obj": 0.9475438726909853, "spy_cagr": 0.1367890043114084}, "WF-train 2005-2016": {"final": 319774.58611641556, "cagr": 0.10181519646115778, "mdd": -0.3115266583183487, "sharpe": 0.6786699839558648, "obj": 0.7329432479047548, "spy_cagr": 0.07467856448671273}, "WF-test 2017-2024": {"final": 342181.9788397858, "cagr": 0.16647030339266577, "mdd": -0.23037838685004797, "sharpe": 0.982308617576945, "obj": 1.0221864594241419, "spy_cagr": 0.14653138246906727}}}
{"iter": 38, "name": "lb_189", "flags": {"rotation_momentum_weight": true, "rotation_defensive_symbol": "GLD", "lookbacks": [189], "rotation_vol_target": 0.1, "rotation_vol_window": 30}, "decision": "REVERT", "windows": {"2005-2024": {"final": 903703.5131648544, "cagr": 0.11641969003576125, "mdd": -0.3220321608801999, "sharpe": 0.7424240097918593, "obj": 0.768830476051001, "spy_cagr": 0.10321645690619041}, "2005-2014": {"final": 275737.80884988303, "cagr": 0.10685793530537224, "mdd": -0.3220321608801999, "sharpe": 0.6787715456677099, "obj": 0.7391750544756803, "spy_cagr": 0.07665618090138704}, "2015-2024": {"final": 327433.1552721721, "cagr": 0.12602374215322465, "mdd": -0.24413799392198302, "sharpe": 0.8093241594988922, "obj": 0.8002800179132212, "spy_cagr": 0.13054581294606016}, "2018-2024": {"final": 232484.852120062, "cagr": 0.12823210378015637, "mdd": -0.24156060509225075, "sharpe": 0.7690750490410995, "obj": 0.7519612479785954, "spy_cagr": 0.1367890043114084}, "WF-train 2005-2016": {"final": 316443.0003000557, "cagr": 0.10085311098316652, "mdd": -0.3220321608801999, "sharpe": 0.6669971334008882, "obj": 0.7193462263937958, "spy_cagr": 0.07467856448671273}, "WF-test 2017-2024": {"final": 283020.38128224143, "cagr": 0.13908106608981208, "mdd": -0.2426272316390505, "sharpe": 0.8455669635852109, "obj": 0.8306663308267005, "spy_cagr": 0.14653138246906727}}}
{"iter": 39, "name": "lb_210", "flags": {"rotation_momentum_weight": true, "rotation_defensive_symbol": "GLD", "lookbacks": [210], "rotation_vol_target": 0.1, "rotation_vol_window": 30}, "decision": "REVERT", "windows": {"2005-2024": {"final": 1232443.1989798467, "cagr": 0.13388295163816766, "mdd": -0.29898634316280714, "sharpe": 0.8380276705438418, "obj": 0.8993606600077962, "spy_cagr": 0.10321645690619041}, "2005-2014": {"final": 337522.7200049885, "cagr": 0.12948631754878925, "mdd": -0.29898634316280714, "sharpe": 0.8036551233422848, "obj": 0.9093153966370893, "spy_cagr": 0.07665618090138704}, "2015-2024": {"final": 367906.483059022, "cagr": 0.139232833689529, "mdd": -0.24247001509131513, "sharpe": 0.8789906895786641, "obj": 0.8963647310656018, "spy_cagr": 0.13054581294606016}, "2018-2024": {"final": 256794.74353691994, "cagr": 0.14439330108459125, "mdd": -0.24150619721621405, "sharpe": 0.8462034958594761, "obj": 0.8614120894058418, "spy_cagr": 0.1367890043114084}, "WF-train 2005-2016": {"final": 377843.7276071403, "cagr": 0.11725754691601753, "mdd": -0.29898634316280714, "sharpe": 0.7625136719906512, "obj": 0.8476716368492608, "spy_cagr": 0.07467856448671273}, "WF-test 2017-2024": {"final": 323444.2257861041, "cagr": 0.15827659178844145, "mdd": -0.24166360936123288, "sharpe": 0.940692278199679, "obj": 0.9641826968384274, "spy_cagr": 0.14653138246906727}}}
{"iter": 40, "name": "lb_126_252", "flags": {"rotation_momentum_weight": true, "rotation_defensive_symbol": "GLD", "lookbacks": [126, 252], "rotation_vol_target": 0.1, "rotation_vol_window": 30}, "decision": "REVERT", "windows": {"2005-2024": {"final": 1036921.3276678639, "cagr": 0.12412631692794962, "mdd": -0.31502232029606386, "sharpe": 0.7826670612994056, "obj": 0.824486781342924, "spy_cagr": 0.10321645690619041}, "2005-2014": {"final": 298402.2935788624, "cagr": 0.11564431602848901, "mdd": -0.31502232029606386, "sharpe": 0.7319650518807598, "obj": 0.8099413221349637, "spy_cagr": 0.07665618090138704}, "2015-2024": {"final": 348790.4805219577, "cagr": 0.1331662322324989, "mdd": -0.2473185203785322, "sharpe": 0.8372128227540658, "obj": 0.8424536613269433, "spy_cagr": 0.13054581294606016}, "2018-2024": {"final": 257366.0978313142, "cagr": 0.1447570907278073, "mdd": -0.2449497264612167, "sharpe": 0.8390082250349573, "obj": 0.8549443978677551, "spy_cagr": 0.1367890043114084}, "WF-train 2005-2016": {"final": 326523.57545621047, "cagr": 0.10373631420481644, "mdd": -0.31502232029606386, "sharpe": 0.6889224504333373, "obj": 0.7470379498695447, "spy_cagr": 0.07467856448671273}, "WF-test 2017-2024": {"final": 315703.28727403405, "cagr": 0.15476985871672255, "mdd": -0.24542283408241636, "sharpe": 0.9117300728296939, "obj": 0.9282070253250044, "spy_cagr": 0.14653138246906727}}}
{"iter": 41, "name": "floor_0.20", "flags": {"rotation_momentum_weight": true, "rotation_defensive_symbol": "GLD", "lookbacks": [252], "rotation_vol_target": 0.1, "rotation_vol_window": 30, "rotation_weight_floor": 0.2}, "decision": "REVERT", "windows": {"2005-2024": {"final": 1158735.137412956, "cagr": 0.1303901255169615, "mdd": -0.31421631432850683, "sharpe": 0.8193708592465914, "obj": 0.8737181964681335, "spy_cagr": 0.10321645690619041}, "2005-2014": {"final": 297456.7910447422, "cagr": 0.11528997402782726, "mdd": -0.31421631432850683, "sharpe": 0.7309424121170195, "obj": 0.8082099983698999, "spy_cagr": 0.07665618090138704}, "2015-2024": {"final": 391466.691196881, "cagr": 0.14633110541258398, "mdd": -0.24605157125557067, "sharpe": 0.9138916231943238, "obj": 0.9454622081273715, "spy_cagr": 0.13054581294606016}, "2018-2024": {"final": 287887.69271497254, "cagr": 0.16325234772423647, "mdd": -0.2447968591961951, "sharpe": 0.9336006764558334, "obj": 0.9865273632814896, "spy_cagr": 0.1367890043114084}, "WF-train 2005-2016": {"final": 323230.9052966889, "cagr": 0.10280364054519509, "mdd": -0.31421631432850683, "sharpe": 0.6849860747083825, "obj": 0.7412362268253472, "spy_cagr": 0.07467856448671273}, "WF-test 2017-2024": {"final": 355797.2078734093, "cagr": 0.17218123767884475, "mdd": -0.24462196651794432, "sharpe": 1.0047647779971713, "obj": 1.0560644884167263, "spy_cagr": 0.14653138246906727}}}
{"iter": 42, "name": "floor_0.10", "flags": {"rotation_momentum_weight": true, "rotation_defensive_symbol": "GLD", "lookbacks": [252], "rotation_vol_target": 0.1, "rotation_vol_window": 30, "rotation_weight_floor": 0.1}, "decision": "KEEP", "windows": {"2005-2024": {"final": 1176498.3177533709, "cagr": 0.13125078291011305, "mdd": -0.31720269568552745, "sharpe": 0.8215477720070935, "obj": 0.8776164240149388, "spy_cagr": 0.10321645690619041}, "2005-2014": {"final": 299134.81344939815, "cagr": 0.11591814547824897, "mdd": -0.31720269568552745, "sharpe": 0.73277993592873, "obj": 0.8113038650824539, "spy_cagr": 0.07665618090138704}, "2015-2024": {"final": 395250.51937246986, "cagr": 0.14743508890340484, "mdd": -0.2460573967971506, "sharpe": 0.9161919996907105, "obj": 0.9499705516053999, "spy_cagr": 0.13054581294606016}, "2018-2024": {"final": 290183.1638298379, "cagr": 0.16457429142209068, "mdd": -0.24481254465342997, "sharpe": 0.9356847232247949, "obj": 0.9912552974461595, "spy_cagr": 0.1367890043114084}, "WF-train 2005-2016": {"final": 325620.9218790632, "cagr": 0.1034814915598472, "mdd": -0.31720269568552745, "sharpe": 0.6874905544428987, "obj": 0.7450964085891677, "spy_cagr": 0.07467856448671273}, "WF-test 2017-2024": {"final": 358633.89240341703, "cagr": 0.17334696917904457, "mdd": -0.24463757166278907, "sharpe": 1.0061118371694096, "obj": 1.0597430105893642, "spy_cagr": 0.14653138246906727}}}
{"iter": 43, "name": "no_abs_mom", "flags": {"rotation_momentum_weight": true, "rotation_defensive_symbol": "GLD", "lookbacks": [252], "rotation_vol_target": 0.1, "rotation_vol_window": 30, "rotation_weight_floor": 0.1, "rotation_abs_momentum": false}, "decision": "KEEP", "windows": {"2005-2024": {"final": 1154419.2236714275, "cagr": 0.13017911974524754, "mdd": -0.3152872845833504, "sharpe": 0.8253589330682297, "obj": 0.879284258746344, "spy_cagr": 0.10321645690619041}, "2005-2014": {"final": 291828.0623431828, "cagr": 0.11315929893994436, "mdd": -0.3152872845833504, "sharpe": 0.7348530811136329, "obj": 0.8078593171907476, "spy_cagr": 0.07665618090138704}, "2015-2024": {"final": 397306.0876632421, "cagr": 0.14803084815548906, "mdd": -0.24492485820442483, "sharpe": 0.9186158928509057, "obj": 0.9535859632697635, "spy_cagr": 0.13054581294606016}, "2018-2024": {"final": 291070.48331719835, "cagr": 0.1650828910153581, "mdd": -0.24380318749503016, "sharpe": 0.9371325476497595, "obj": 0.993720321057659, "spy_cagr": 0.1367890043114084}, "WF-train 2005-2016": {"final": 318489.0990026924, "cagr": 0.10144507074795484, "mdd": -0.3152872845833504, "sharpe": 0.6902759693820605, "obj": 0.7438089819045447, "spy_cagr": 0.07467856448671273}, "WF-test 2017-2024": {"final": 359721.1492683034, "cagr": 0.1737916383440381, "mdd": -0.24367010655640167, "sharpe": 1.0072908833491208, "obj": 1.0618113950990624, "spy_cagr": 0.14653138246906727}}}
