{"iter": 57, "name": "vt_0.11", "flags": {"rotation_momentum_weight": true, "rotation_defensive_symbol": "GLD", "lookbacks": [252], "rotation_vol_target": 0.11, "rotation_vol_window": 30, "rotation_weight_floor": 0.1, "rotation_abs_momentum": false}, "decision": "REVERT", "windows": {"2005-2024": {"final": 1187557.8061480345, "cagr": 0.13178042053973726, "mdd": -0.32401972524744077, "sharpe": 0.8164561537410201, "obj": 0.8735840810081138, "spy_cagr": 0.10321645690619041}, "2005-2014": {"final": 290952.0470851958, "cagr": 0.11282437544858626, "mdd": -0.32401972524744077, "sharpe": 0.7254678421291311, "obj": 0.7978042312235295, "spy_cagr": 0.07665618090138704}, "2015-2024": {"final": 408846.0558633033, "cagr": 0.151324824560517, "mdd": -0.2590960473652509, "sharpe": 0.9066166902053798, "obj": 0.9481747134342935, "spy_cagr": 0.13054581294606016}, "2018-2024": {"final": 302262.04658651655, "cagr": 0.17138625572754185, "mdd": -0.2577705200678464, "sharpe": 0.9357765580953292, "obj": 1.0049710609275961, "spy_cagr": 0.1367890043114084}, "WF-train 2005-2016": {"final": 315392.914157992, "cagr": 0.10054794546038437, "mdd": -0.32401972524744077, "sharpe": 0.6766180681800263, "obj": 0.7283568301273696, "spy_cagr": 0.07467856448671273}, "WF-test 2017-2024": {"final": 373579.42030359263, "cagr": 0.17935878364269087, "mdd": -0.25760777807860535, "sharpe": 1.0022116845231088, "obj": 1.067866486870356, "spy_cagr": 0.14653138246906727}}}
{"iter": 58, "name": "floor_0.20", "flags": {"rotation_momentum_weight": true, "rotation_defensive_symbol": "GLD", "lookbacks": [252], "rotation_vol_target": 0.09, "rotation_vol_window": 30, "rotation_weight_floor": 0.2, "rotation_abs_momentum": false}, "decision": "REVERT", "windows": {"2005-2024": {"final": 1087729.4864037854, "cagr": 0.12681972062078506, "mdd": -0.30664348018753385, "sharpe": 0.8282397681337031, "obj": 0.8754462955628924, "spy_cagr": 0.10321645690619041}, "2005-2014": {"final": 290232.1449475037, "cagr": 0.11254845808402436, "mdd": -0.30664348018753385, "sharpe": 0.7409801877504955, "obj": 0.8127647421157701, "spy_cagr": 0.07665618090138704}, "2015-2024": {"final": 377175.2594420442, "cagr": 0.1420728543948535, "mdd": -0.2291022943429675, "sharpe": 0.9225161547288897, "obj": 0.9455702376264764, "spy_cagr": 0.13054581294606016}, "2018-2024": {"final": 275884.25989146566, "cagr": 0.15618886323022108, "mdd": -0.22825379386855132, "sharpe": 0.9317566467768642, "obj": 0.9705563646144896, "spy_cagr": 0.1367890043114084}, "WF-train 2005-2016": {"final": 316564.1591277887, "cagr": 0.10088826120162842, "mdd": -0.30664348018753385, "sharpe": 0.6976329266165137, "obj": 0.750052320046345, "spy_cagr": 0.07467856448671273}, "WF-test 2017-2024": {"final": 340900.6556675601, "cagr": 0.16592266662590438, "mdd": -0.2281090871254018, "sharpe": 1.0072109501304736, "obj": 1.0459935184441478, "spy_cagr": 0.14653138246906727}}}
{"iter": 59, "name": "top5", "flags": {"rotation_momentum_weight": true, "rotation_defensive_symbol": "GLD", "lookbacks": [252], "rotation_vol_target": 0.09, "rotation_vol_window": 30, "rotation_weight_floor": 0.1, "rotation_abs_momentum": false, "top_n": 5}, "decision": "REVERT", "windows": {"2005-2024": {"final": 968721.2166237803, "cagr": 0.12030675867397478, "mdd": -0.30346307648761, "sharpe": 0.8290724409134128, "obj": 0.8632530444489815, "spy_cagr": 0.10321645690619041}, "2005-2014": {"final": 298398.36425951857, "cagr": 0.11564284554598747, "mdd": -0.30346307648761, "sharpe": 0.7805605169201996, "obj": 0.8585338462094004, "spy_cagr": 0.07665618090138704}, "2015-2024": {"final": 327202.4981183134, "cagr": 0.1259443409866432, "mdd": -0.22192033303368708, "sharpe": 0.8878335430007293, "obj": 0.8786305990818953, "spy_cagr": 0.13054581294606016}, "2018-2024": {"final": 241612.6069216883, "cagr": 0.13446291022558188, "mdd": -0.22130035172038431, "sharpe": 0.8753701007786572, "obj": 0.8707179126070042, "spy_cagr": 0.1367890043114084}, "WF-train 2005-2016": {"final": 322208.3309041884, "cagr": 0.1025122160917542, "mdd": -0.30346307648761, "sharpe": 0.7281227845673802, "obj": 0.7837900877774632, "spy_cagr": 0.07467856448671273}, "WF-test 2017-2024": {"final": 298606.90818983916, "cagr": 0.1467503723570529, "mdd": -0.2214676618737663, "sharpe": 0.9721784370531624, "obj": 0.9726164168291337, "spy_cagr": 0.14653138246906727}}}
