{"iter": 44, "name": "top4_vt", "flags": {"rotation_momentum_weight": true, "rotation_defensive_symbol": "GLD", "lookbacks": [252], "rotation_vol_target": 0.1, "rotation_vol_window": 30, "rotation_weight_floor": 0.1, "rotation_abs_momentum": false, "top_n": 4}, "decision": "REVERT", "windows": {"2005-2024": {"final": 1028118.9196499793, "cagr": 0.12364698541312436, "mdd": -0.3145435726449204, "sharpe": 0.812872769931486, "obj": 0.8537338269453539, "spy_cagr": 0.10321645690619041}, "2005-2014": {"final": 295485.99560618564, "cagr": 0.1145481173115257, "mdd": -0.3145435726449204, "sharpe": 0.7562049487750049, "obj": 0.8319888215952822, "spy_cagr": 0.07665618090138704}, "2015-2024": {"final": 350128.8771873375, "cagr": 0.13360060492289105, "mdd": -0.24082292104053496, "sharpe": 0.8750745003015663, "obj": 0.8811840842552281, "spy_cagr": 0.13054581294606016}, "2018-2024": {"final": 264079.6088140429, "cagr": 0.1489806364931856, "mdd": -0.23983411002679644, "sharpe": 0.8944507053070095, "obj": 0.918833969670564, "spy_cagr": 0.1367890043114084}, "WF-train 2005-2016": {"final": 315700.47463832854, "cagr": 0.10063742192800773, "mdd": -0.3145435726449204, "sharpe": 0.698129667724548, "obj": 0.750047382607138, "spy_cagr": 0.07467856448671273}, "WF-test 2017-2024": {"final": 323274.49258845346, "cagr": 0.15820049184798468, "mdd": -0.2398902044757351, "sharpe": 0.9698721717226579, "obj": 0.9932103904804928, "spy_cagr": 0.14653138246906727}}}
{"iter": 0, "name": "R4-champion", "flags": {"rotation_momentum_weight": true, "rotation_defensive_symbol": "GLD", "lookbacks": [252], "rotation_vol_target": 0.1, "rotation_vol_window": 30, "rotation_weight_floor": 0.1, "rotation_abs_momentum": false}, "decision": "BASELINE", "windows": {"2005-2024": {"final": 1154419.2236714275, "cagr": 0.13017911974524754, "mdd": -0.31528728458335037, "sharpe": 0.825358933068231, "obj": 0.8792842587463453, "spy_cagr": 0.10321645690619041}, "2005-2014": {"final": 291828.0623431829, "cagr": 0.11315929893994459, "mdd": -0.31528728458335037, "sharpe": 0.7348530811136343, "obj": 0.8078593171907494, "spy_cagr": 0.07665618090138704}, "2015-2024": {"final": 397306.08766324195, "cagr": 0.14803084815548906, "mdd": -0.24492485820442514, "sharpe": 0.9186158928509065, "obj": 0.9535859632697643, "spy_cagr": 0.13054581294606016}, "2018-2024": {"final": 291070.4833171983, "cagr": 0.1650828910153581, "mdd": -0.24380318749503035, "sharpe": 0.9371325476497626, "obj": 0.9937203210576621, "spy_cagr": 0.1367890043114084}, "WF-train 2005-2016": {"final": 318489.0990026925, "cagr": 0.10144507074795506, "mdd": -0.31528728458335037, "sharpe": 0.6902759693820613, "obj": 0.7438089819045459, "spy_cagr": 0.07467856448671273}, "WF-test 2017-2024": {"final": 359721.14926830324, "cagr": 0.1737916383440381, "mdd": -0.24367010655640198, "sharpe": 1.0072908833491208, "obj": 1.0618113950990624, "spy_cagr": 0.14653138246906727}}}
{"iter": 45, "name": "equalweight_vt", "flags": {"rotation_momentum_weight": false, "rotation_defensive_symbol": "GLD", "lookbacks": [252], "rotation_vol_target": 0.1, "rotation_vol_window": 30, "rotation_weight_floor": 0.1, "rotation_abs_momentum": false}, "decision": "REVERT", "windows": {"2005-2024": {"final": 1017278.5245050987, "cagr": 0.12305129022993455, "mdd": -0.3162004340734306, "sharpe": 0.8125454206064908, "obj": 0.8522150872539791, "spy_cagr": 0.10321645690619041}, "2005-2014": {"final": 270593.2524026176, "cagr": 0.10477328206502712, "mdd": -0.3162004340734306, "sharpe": 0.7057372956640584, "obj": 0.7619714979913386, "spy_cagr": 0.07665618090138704}, "2015-2024": {"final": 377185.33688985516, "cagr": 0.14207590786239654, "mdd": -0.24354901262406567, "sharpe": 0.9234959140469978, "obj": 0.9465561038796706, "spy_cagr": 0.13054581294606016}, "2018-2024": {"final": 280054.8420818893, "cagr": 0.15867240657591153, "mdd": -0.24233040265689132, "sharpe": 0.9459352516549507, "obj": 0.989702056183957, "spy_cagr": 0.1367890043114084}, "WF-train 2005-2016": {"final": 293883.538533718, "cagr": 0.09408293193140072, "mdd": -0.3162004340734306, "sharpe": 0.6634650370092533, "obj": 0.7022737718986293, "spy_cagr": 0.07467856448671273}, "WF-test 2017-2024": {"final": 343016.83250438154, "cagr": 0.16682615491441655, "mdd": -0.24206684779901982, "sharpe": 1.0157276360713916, "obj": 1.0563171809620902, "spy_cagr": 0.14653138246906727}}}
{"iter": 46, "name": "regime_plus", "flags": {"rotation_momentum_weight": true, "rotation_defensive_symbol": "GLD", "lookbacks": [252], "rotation_vol_target": 0.1, "rotation_vol_window": 30, "rotation_weight_floor": 0.1, "rotation_abs_momentum": false, "rotation_regime_filter": true}, "decision": "REVERT", "windows": {"2005-2024": {"final": 1003839.6369567466, "cagr": 0.12230437550852402, "mdd": -0.2936667076207303, "sharpe": 0.7622389733042747, "obj": 0.8004148105089419, "spy_cagr": 0.10321645690619041}, "2005-2014": {"final": 302090.02895967045, "cagr": 0.11701676706494268, "mdd": -0.2936667076207303, "sharpe": 0.70692675108147, "obj": 0.7876479234085813, "spy_cagr": 0.07665618090138704}, "2015-2024": {"final": 338494.04786574346, "cagr": 0.1297734754466635, "mdd": -0.23561082324390142, "sharpe": 0.8366092802289473, "obj": 0.835064605230154, "spy_cagr": 0.13054581294606016}, "2018-2024": {"final": 241082.40034431667, "cagr": 0.13410654617427653, "mdd": -0.23262982523066955, "sharpe": 0.8125075569930718, "obj": 0.807142640718808, "spy_cagr": 0.1367890043114084}, "WF-train 2005-2016": {"final": 336042.25982771174, "cagr": 0.10638486879113329, "mdd": -0.2936667076207303, "sharpe": 0.6725738396118918, "obj": 0.7359864482207329, "spy_cagr": 0.07467856448671273}, "WF-test 2017-2024": {"final": 297874.25676863955, "cagr": 0.1463978083827382, "mdd": -0.23232822826086721, "sharpe": 0.8982486669448385, "obj": 0.8979815187721804, "spy_cagr": 0.14653138246906727}}}
{"iter": 47, "name": "single_tranche", "flags": {"rotation_momentum_weight": true, "rotation_defensive_symbol": "GLD", "lookbacks": [252], "rotation_vol_target": 0.1, "rotation_vol_window": 30, "rotation_weight_floor": 0.1, "rotation_abs_momentum": false, "tranches": [0]}, "decision": "REVERT", "windows": {"2005-2024": {"final": 1121687.876724035, "cagr": 0.12855404308478469, "mdd": -0.3106168182873071, "sharpe": 0.8166348362817131, "obj": 0.8673100086389016, "spy_cagr": 0.10321645690619041}, "2005-2014": {"final": 296799.31066310796, "cagr": 0.1150429749192563, "mdd": -0.3106168182873071, "sharpe": 0.7447521702458637, "obj": 0.8215257582816022, "spy_cagr": 0.07665618090138704}, "2015-2024": {"final": 377163.9622246106, "cagr": 0.14206943124972304, "mdd": -0.20867550379125915, "sharpe": 0.8876116985785983, "obj": 0.9106589351859241, "spy_cagr": 0.13054581294606016}, "2018-2024": {"final": 292286.39946430834, "cagr": 0.16577768418997607, "mdd": -0.20867550379125935, "sharpe": 0.9429956693635325, "obj": 1.0009730291206678, "spy_cagr": 0.1367890043114084}, "WF-train 2005-2016": {"final": 308520.00016983144, "cagr": 0.0985273017238264, "mdd": -0.3106168182873071, "sharpe": 0.6722053998915013, "obj": 0.7199028743657286, "spy_cagr": 0.07467856448671273}, "WF-test 2017-2024": {"final": 361340.17989757156, "cagr": 0.17445161959746902, "mdd": -0.20867550379125935, "sharpe": 1.0129398415499768, "obj": 1.0687803158067803, "spy_cagr": 0.14653138246906727}}}
{"iter": 48, "name": "four_tranche", "flags": {"rotation_momentum_weight": true, "rotation_defensive_symbol": "GLD", "lookbacks": [252], "rotation_vol_target": 0.1, "rotation_vol_window": 30, "rotation_weight_floor": 0.1, "rotation_abs_momentum": false, "tranches": [0, 7, 14, 21]}, "decision": "REVERT", "windows": {"2005-2024": {"final": 1133509.4043096527, "cagr": 0.12914610505529467, "mdd": -0.30923855932689176, "sharpe": 0.8223514210337891, "obj": 0.8742107173319976, "spy_cagr": 0.10321645690619041}, "2005-2014": {"final": 298980.8986602723, "cagr": 0.11586065940287593, "mdd": -0.30923855932689176, "sharpe": 0.7519381234623695, "obj": 0.8303470804653473, "spy_cagr": 0.07665618090138704}, "2015-2024": {"final": 379164.2128422685, "cagr": 0.14267408945531912, "mdd": -0.23829057267017378, "sharpe": 0.8931917106962582, "obj": 0.9174482637147762, "spy_cagr": 0.13054581294606016}, "2018-2024": {"final": 279320.6316565117, "cagr": 0.15823750012555626, "mdd": -0.23769879072957484, "sharpe": 0.9083313705032492, "obj": 0.9512283621315449, "spy_cagr": 0.1367890043114084}, "WF-train 2005-2016": {"final": 326681.0543196667, "cagr": 0.10378070494287006, "mdd": -0.30923855932689176, "sharpe": 0.7053363639948448, "obj": 0.7635406449071594, "spy_cagr": 0.07467856448671273}, "WF-test 2017-2024": {"final": 344659.4037006509, "cagr": 0.16752408505353422, "mdd": -0.2376161933209478, "sharpe": 0.9805391658119734, "obj": 1.0225245709809072, "spy_cagr": 0.14653138246906727}}}
{"iter": 49, "name": "drop_QQQ", "flags": {"rotation_momentum_weight": true, "rotation_defensive_symbol": "GLD", "lookbacks": [252], "rotation_vol_target": 0.1, "rotation_vol_window": 30, "rotation_weight_floor": 0.1, "rotation_abs_momentum": false, "universe": ["XLK", "XLF", "XLE", "XLV", "XLI", "XLY", "XLB", "XLP", "XLU", "XLRE", "XLC", "SMH"]}, "decision": "REVERT", "windows": {"2005-2024": {"final": 1085113.6210625318, "cagr": 0.12668399764303828, "mdd": -0.31375766379647324, "sharpe": 0.8131322669485341, "obj": 0.8600673484222299, "spy_cagr": 0.10321645690619041}, "2005-2014": {"final": 296176.497763069, "cagr": 0.1148085449728502, "mdd": -0.31375766379647324, "sharpe": 0.744194800784975, "obj": 0.8204995289279013, "spy_cagr": 0.07665618090138704}, "2015-2024": {"final": 367929.4040562461, "cagr": 0.13923993590340777, "mdd": -0.24527976554621167, "sharpe": 0.8863204045486306, "obj": 0.9037086504633258, "spy_cagr": 0.13054581294606016}, "2018-2024": {"final": 273062.85189093207, "cagr": 0.15449043132507057, "mdd": -0.244154773827416, "sharpe": 0.9007819301725017, "obj": 0.9361847841998261, "spy_cagr": 0.1367890043114084}, "WF-train 2005-2016": {"final": 320878.0885987943, "cagr": 0.10213183773933121, "mdd": -0.31375766379647324, "sharpe": 0.6951586919315754, "obj": 0.7500652384368124, "spy_cagr": 0.07467856448671273}, "WF-test 2017-2024": {"final": 335527.79239431414, "cagr": 0.163606520217896, "mdd": -0.24427261452547042, "sharpe": 0.973661219470545, "obj": 1.0078114949682024, "spy_cagr": 0.14653138246906727}}}
{"iter": 50, "name": "drop_SMH", "flags": {"rotation_momentum_weight": true, "rotation_defensive_symbol": "GLD", "lookbacks": [252], "rotation_vol_target": 0.1, "rotation_vol_window": 30, "rotation_weight_floor": 0.1, "rotation_abs_momentum": false, "universe": ["XLK", "XLF", "XLE", "XLV", "XLI", "XLY", "XLB", "XLP", "XLU", "XLRE", "XLC", "QQQ"]}, "decision": "REVERT", "windows": {"2005-2024": {"final": 883634.4131249369, "cagr": 0.11516608451963406, "mdd": -0.3152863156864025, "sharpe": 0.7785917415866092, "obj": 0.8024909968134964, "spy_cagr": 0.10321645690619041}, "2005-2014": {"final": 311995.8904628872, "cagr": 0.12063010283160591, "mdd": -0.3152863156864025, "sharpe": 0.7781325558729371, "obj": 0.8660803997333748, "spy_cagr": 0.07665618090138704}, "2015-2024": {"final": 284318.4029261832, "cagr": 0.11022647528253837, "mdd": -0.2324593339834176, "sharpe": 0.7846662745608304, "obj": 0.7440275992337868, "spy_cagr": 0.13054581294606016}, "2018-2024": {"final": 241215.50282833335, "cagr": 0.13419607051325744, "mdd": -0.23128959665268578, "sharpe": 0.8664815614382851, "obj": 0.8612956938419832, "spy_cagr": 0.1367890043114084}, "WF-train 2005-2016": {"final": 317776.349297694, "cagr": 0.1012392607688497, "mdd": -0.3152863156864025, "sharpe": 0.6938347987215955, "obj": 0.7469561912858694, "spy_cagr": 0.07467856448671273}, "WF-test 2017-2024": {"final": 275172.5590008077, "cagr": 0.13507868079389218, "mdd": -0.2313289970915469, "sharpe": 0.9007160868379851, "obj": 0.8778106834876349, "spy_cagr": 0.14653138246906727}}}
{"iter": 51, "name": "gold_ranked", "flags": {"rotation_momentum_weight": true, "rotation_defensive_symbol": "GLD", "lookbacks": [252], "rotation_vol_target": 0.1, "rotation_vol_window": 30, "rotation_weight_floor": 0.1, "rotation_abs_momentum": false, "universe": ["XLK", "XLF", "XLE", "XLV", "XLI", "XLY", "XLB", "XLP", "XLU", "XLRE", "XLC", "SMH", "QQQ", "GLD"]}, "decision": "REVERT", "windows": {"2005-2024": {"final": 1171669.3699562547, "cagr": 0.1310180401929366, "mdd": -0.30937030294643025, "sharpe": 0.8218778551957583, "obj": 0.8774810217692507, "spy_cagr": 0.10321645690619041}, "2005-2014": {"final": 306577.3789920046, "cagr": 0.11866661664366385, "mdd": -0.30937030294643025, "sharpe": 0.7501367473908235, "obj": 0.8341576188753771, "spy_cagr": 0.07665618090138704}, "2015-2024": {"final": 384262.68624050485, "cagr": 0.14420242659392324, "mdd": -0.24511050620524225, "sharpe": 0.8988815365377804, "obj": 0.9261947638335065, "spy_cagr": 0.13054581294606016}, "2018-2024": {"final": 285733.868843743, "cagr": 0.16200373763717968, "mdd": -0.24365399442709565, "sharpe": 0.9231362568244074, "obj": 0.9735657234759499, "spy_cagr": 0.1367890043114084}, "WF-train 2005-2016": {"final": 329582.11795015377, "cagr": 0.10459497837710763, "mdd": -0.30937030294643025, "sharpe": 0.6961114610217601, "obj": 0.7559442888025499, "spy_cagr": 0.07467856448671273}, "WF-test 2017-2024": {"final": 353119.84556023043, "cagr": 0.17107349676883765, "mdd": -0.24349505372535366, "sharpe": 0.994670771486002, "obj": 1.0437550000855427, "spy_cagr": 0.14653138246906727}}}
{"iter": 52, "name": "lb_189_252", "flags": {"rotation_momentum_weight": true, "rotation_defensive_symbol": "GLD", "lookbacks": [189, 252], "rotation_vol_target": 0.1, "rotation_vol_window": 30, "rotation_weight_floor": 0.1, "rotation_abs_momentum": false}, "decision": "REVERT", "windows": {"2005-2024": {"final": 952908.683010989, "cagr": 0.11938474455662051, "mdd": -0.3178687973957984, "sharpe": 0.7629563886563306, "obj": 0.7952929639571908, "spy_cagr": 0.10321645690619041}, "2005-2014": {"final": 289042.05080256256, "cagr": 0.11209097637681209, "mdd": -0.3178687973957984, "sharpe": 0.7242218691471924, "obj": 0.7950914600980425, "spy_cagr": 0.07665618090138704}, "2015-2024": {"final": 331624.0122509059, "cagr": 0.12745770168082848, "mdd": -0.2447043463804003, "sharpe": 0.805617962648468, "obj": 0.7994417401180046, "spy_cagr": 0.13054581294606016}, "2018-2024": {"final": 243109.39321448875, "cagr": 0.1354653305826663, "mdd": -0.2423286534894185, "sharpe": 0.7922146500619632, "obj": 0.789567302604479, "spy_cagr": 0.1367890043114084}, "WF-train 2005-2016": {"final": 319310.62311590416, "cagr": 0.10168176679684438, "mdd": -0.3178687973957984, "sharpe": 0.6867203120280906, "obj": 0.7407267166483539, "spy_cagr": 0.07467856448671273}, "WF-test 2017-2024": {"final": 295768.49323665106, "cagr": 0.14538023973565384, "mdd": -0.24330214396450361, "sharpe": 0.8638085695499782, "obj": 0.8615062840831513, "spy_cagr": 0.14653138246906727}}}
{"iter": 53, "name": "lb_126_189_252", "flags": {"rotation_momentum_weight": true, "rotation_defensive_symbol": "GLD", "lookbacks": [126, 189, 252], "rotation_vol_target": 0.1, "rotation_vol_window": 30, "rotation_weight_floor": 0.1, "rotation_abs_momentum": false}, "decision": "REVERT", "windows": {"2005-2024": {"final": 923335.8816858957, "cagr": 0.11762068269677428, "mdd": -0.316566523900357, "sharpe": 0.7536120176343862, "obj": 0.782420469215554, "spy_cagr": 0.10321645690619041}, "2005-2014": {"final": 277956.8170867273, "cagr": 0.10774632477081103, "mdd": -0.316566523900357, "sharpe": 0.701617737601132, "obj": 0.76379802533998, "spy_cagr": 0.07665618090138704}, "2015-2024": {"final": 333358.04138459277, "cagr": 0.12804625849691176, "mdd": -0.24471701874005522, "sharpe": 0.8079795326409664, "obj": 0.8029804237426696, "spy_cagr": 0.13054581294606016}, "2018-2024": {"final": 242483.0430073167, "cagr": 0.13504649974661098, "mdd": -0.24289476578416072, "sharpe": 0.7888994317309733, "obj": 0.7854144226013785, "spy_cagr": 0.1367890043114084}, "WF-train 2005-2016": {"final": 310020.8040942728, "cagr": 0.09897203587531922, "mdd": -0.316566523900357, "sharpe": 0.6725463944930188, "obj": 0.7211333372702318, "spy_cagr": 0.07467856448671273}, "WF-test 2017-2024": {"final": 295449.48889600125, "cagr": 0.14522553475800004, "mdd": -0.2434188963325136, "sharpe": 0.8613190810020434, "obj": 0.8587073855799089, "spy_cagr": 0.14653138246906727}}}
{"iter": 54, "name": "volwin_30", "flags": {"rotation_momentum_weight": true, "rotation_defensive_symbol": "GLD", "lookbacks": [252], "rotation_vol_target": 0.1, "rotation_vol_window": 30, "rotation_weight_floor": 0.1, "rotation_abs_momentum": false}, "decision": "REVERT", "windows": {"2005-2024": {"final": 1154419.2236714275, "cagr": 0.13017911974524754, "mdd": -0.31528728458335037, "sharpe": 0.825358933068231, "obj": 0.8792842587463453, "spy_cagr": 0.10321645690619041}, "2005-2014": {"final": 291828.0623431829, "cagr": 0.11315929893994459, "mdd": -0.31528728458335037, "sharpe": 0.7348530811136343, "obj": 0.8078593171907494, "spy_cagr": 0.07665618090138704}, "2015-2024": {"final": 397306.08766324195, "cagr": 0.14803084815548906, "mdd": -0.24492485820442514, "sharpe": 0.9186158928509065, "obj": 0.9535859632697643, "spy_cagr": 0.13054581294606016}, "2018-2024": {"final": 291070.4833171983, "cagr": 0.1650828910153581, "mdd": -0.24380318749503035, "sharpe": 0.9371325476497626, "obj": 0.9937203210576621, "spy_cagr": 0.1367890043114084}, "WF-train 2005-2016": {"final": 318489.0990026925, "cagr": 0.10144507074795506, "mdd": -0.31528728458335037, "sharpe": 0.6902759693820613, "obj": 0.7438089819045459, "spy_cagr": 0.07467856448671273}, "WF-test 2017-2024": {"final": 359721.14926830324, "cagr": 0.1737916383440381, "mdd": -0.24367010655640198, "sharpe": 1.0072908833491208, "obj": 1.0618113950990624, "spy_cagr": 0.14653138246906727}}}
{"iter": 55, "name": "volwin_40", "flags": {"rotation_momentum_weight": true, "rotation_defensive_symbol": "GLD", "lookbacks": [252], "rotation_vol_target": 0.1, "rotation_vol_window": 40, "rotation_weight_floor": 0.1, "rotation_abs_momentum": false}, "decision": "REVERT", "windows": {"2005-2024": {"final": 1126448.518925173, "cagr": 0.12879318173664167, "mdd": -0.3143603639197549, "sharpe": 0.8158040305979541, "obj": 0.8669574802588567, "spy_cagr": 0.10321645690619041}, "2005-2014": {"final": 297689.4090357326, "cagr": 0.11537724519893122, "mdd": -0.3143603639197549, "sharpe": 0.7474884115945407, "obj": 0.8249305401896291, "spy_cagr": 0.07665618090138704}, "2015-2024": {"final": 378287.6245022004, "cagr": 0.14240945870885668, "mdd": -0.25778500904841145, "sharpe": 0.8835480195942748, "obj": 0.9072753111198678, "spy_cagr": 0.13054581294606016}, "2018-2024": {"final": 281760.0064374263, "cagr": 0.15967869593124195, "mdd": -0.25691773214664093, "sharpe": 0.9039731648493349, "obj": 0.949752548089002, "spy_cagr": 0.1367890043114084}, "WF-train 2005-2016": {"final": 321113.2956872873, "cagr": 0.10219919948303025, "mdd": -0.3143603639197549, "sharpe": 0.6955867584115751, "obj": 0.7506280284042102, "spy_cagr": 0.07467856448671273}, "WF-test 2017-2024": {"final": 348272.34840797354, "cagr": 0.16904904712538293, "mdd": -0.25676999890394264, "sharpe": 0.9763162791326288, "obj": 1.02135160844526, "spy_cagr": 0.14653138246906727}}}
{"iter": 56, "name": "vt_0.09", "flags": {"rotation_momentum_weight": true, "rotation_defensive_symbol": "GLD", "lookbacks": [252], "rotation_vol_target": 0.09, "rotation_vol_window": 30, "rotation_weight_floor": 0.1, "rotation_abs_momentum": false}, "decision": "KEEP", "windows": {"2005-2024": {"final": 1106437.083713896, "cagr": 0.1277814137512523, "mdd": -0.3065670068222571, "sharpe": 0.8309783627177781, "obj": 0.8801082764079019, "spy_cagr": 0.10321645690619041}, "2005-2014": {"final": 293029.56902778475, "cagr": 0.11361719786620017, "mdd": -0.3065670068222571, "sharpe": 0.7449746343725648, "obj": 0.8188966683021911, "spy_cagr": 0.07665618090138704}, "2015-2024": {"final": 379984.49298251764, "cagr": 0.14292122328841383, "mdd": -0.22909147146158423, "sharpe": 0.9238015435216752, "obj": 0.9485523642063826, "spy_cagr": 0.13054581294606016}, "2018-2024": {"final": 277937.2292113323, "cagr": 0.15741537863807364, "mdd": -0.22826542365838873, "sharpe": 0.9340367166888613, "obj": 0.9752894653421919, "spy_cagr": 0.1367890043114084}, "WF-train 2005-2016": {"final": 319651.13458901277, "cagr": 0.10177971075837422, "mdd": -0.3065670068222571, "sharpe": 0.7010933532205443, "obj": 0.7552956457638673, "spy_cagr": 0.07467856448671273}, "WF-test 2017-2024": {"final": 343436.5451080788, "cagr": 0.16700476885216275, "mdd": -0.22812065290325795, "sharpe": 1.0087719888533802, "obj": 1.0497187616195711, "spy_cagr": 0.14653138246906727}}}
